{
  "$schema": "http://json-schema.org/draft-07/schema#",
  "$id": "https://example.com/template.schema.json",
  "title": "Prompt-Node Game Template",
  "type": "object",
  "additionalProperties": false,
  "properties": {
    "id": { "type": "string", "minLength": 1 },
    "name": { "type": "string", "minLength": 1 },
    "version": { "type": "string", "minLength": 1 },
    "variables": {
      "type": "object",
      "patternProperties": {
        ".*": { "oneOf": [ {"type": "string"}, {"type": "number"}, {"type": "boolean"}, {"type": "null"} ] }
      },
      "additionalProperties": true
    },
    "nodes": {
      "type": "array",
      "minItems": 1,
      "items": {
        "type": "object",
        "additionalProperties": false,
        "properties": {
          "id": { "type": "string", "minLength": 1 },
          "type": { "type": "string", "enum": ["prompt", "tool", "decision", "output"] },
          "name": { "type": "string" },
          "prompt": { "type": "string" },
          "inputs": { "type": "object" },
          "outputs": { "type": "array", "items": { "type": "string" } },
          "params": { "type": "object" }
        },
        "required": ["id", "type"]
      }
    },
    "edges": {
      "type": "array",
      "items": {
        "type": "object",
        "additionalProperties": false,
        "properties": {
          "from": { "type": "string", "minLength": 1 },
          "to": { "type": "string", "minLength": 1 },
          "mapping": { "type": "object" }
        },
        "required": ["from", "to"]
      }
    },
    "testCases": {
      "type": "array",
      "items": {
        "type": "object",
        "additionalProperties": false,
        "properties": {
          "name": { "type": "string" },
          "variables": { "type": "object" },
          "expect": { "type": "object" }
        },
        "required": ["name"]
      }
    }
  },
  "required": ["id", "name", "version", "nodes", "edges"]
}

